{
    "id": "13293",
    "name": "徐禮藩",
    "gender": "男",
    "birth_h": "1921",
    "province": "江蘇",
    "city": "鎮江縣",
    "edu": "暫無資料",
    "d1_num": "暫無資料",
    "occupation": "無",
    "age": "53",
    "d1_per1": "暫無資料",
    "d1_crime1": "暫無資料",
    "d1_crime1cat": "暫無資料",
    "d1_law1": "暫無資料",
    "d1_prosec": "無",
    "d1_pa1": "暫無資料",
    "d1_clk1": "暫無資料",
    "d2_doc": "判決書",
    "d2_num1": "(63)初特字第52號",
    "d2_authority": "台灣警備總司令部",
    "d2_pa1": "臧家正",
    "d2_atty1": "張明俠",
    "d2_attycat": "公設",
    "d2_main1": "連續以文字為有利於叛徒之宣傳",
    "d2_term": "有",
    "d2_termy": "4",
    "d2_termm": "0",
    "d2_dpriv": "有",
    "d2_dprivy": "2",
    "d2_dprivm": "0",
    "d2_law1": "懲治叛亂條例",
    "d2_law1a": "7",
    "d2_law2": "刑法",
    "d2_law2a": "56",
    "d2_law3": "刑法",
    "d2_law3a": "59",
    "d2_j1": "王雲濤",
    "d2_j2": "金振傑",
    "d2_j3": "沈志純",
    "d2_jpos1": "審判長",
    "d2_jpos2": "審判官",
    "d2_jpos3": "審判官",
    "d2_clk1": "傅國光",
    "d2_y": "63",
    "d2_m": "8",
    "d2_d": "22",
    "d2_rejud": "無",
    "f_authority": "台灣警備總司令部",
    "f_jyear": "63",
    "f_num": "(63)初特字第0052號",
    "f_pa1": "臧家正",
    "f_atty1": "張明俠",
    "f_attycat": "公設",
    "f_main1": "連續以文字為有利於叛徒之宣傳",
    "f_law1": "懲治叛亂條例",
    "f_law1a": "7",
    "f_law2": "刑法",
    "f_law2a": "56",
    "f_law3": "刑法",
    "f_law3a": "59",
    "f_penaltytxt": "有期徒刑4年減處有期徒刑2年8月",
    "f_term": "有",
    "f_termy": "4",
    "f_termm": "0",
    "f_forf": "無",
    "f_j1": "王雲濤",
    "f_j2": "金振傑",
    "f_j3": "沈志純",
    "f_clk1": "傅國光",
    "f_y": "63",
    "f_m": "9",
    "f_d": "6",
    "f_txt": "【裁判字號】63，初特，0052\n【裁判日期】630822\n【裁判機關】台灣警備總司令部\n【受裁判者】徐禮藩\n【類　　別】判決書\n【裁判全文】\n\n台灣警備總司令部判決　　　　　　　　　　　　　　　　　　　   (63)年度初特字第五十二號\n    公訴人　本部軍事檢察官\n被　告　徐禮藩　男，年五十三歲（民國十年生），江蘇省鎮江縣人，住台南市，業無，在押。\n指定辯護人　本部公設辯護人張明俠\n右被告因叛亂案件，經軍事檢察官提起公訴，本部判決如左：\n　　主文\n徐禮藩連續以文字為有利於叛徒之宣傳，處有期徒刑四年，褫奪公權二年。獲案載有反動文字之木板三塊，便條乙紙，均沒收。\n　　事實\n徐禮藩於民國六十一年十二月中旬某日，及六十三年四月九日、十日先後在台南市大同路大林眷村公廁內書寫：「打倒蔣ｘｘ，歡迎毛主席，反ｘ迎毛」、「解放台灣、斗垮ｘ匪」等反動文字，案經司法行政部調查局查覺，移送軍事檢察官偵查起訴。\n　　理由\n一、被告徐禮藩對於上述犯罪事實，業據於本部偵審各庭坦白承認，並有自原地拆下之被告親筆書　　　　　　　　　　　　　　　　　　　　　　　　　　　　　　　　　　　　　　　　　　　有反動文字之木板三塊，便條乙紙及現場照片三張為證，該項反動文字，復經司法行政部調查局鑑定結果，認與被告字跡相同，有該局（６３）鑑丑字第三六二七號鑑定書附卷可按，犯罪事證，非常明確。\n二、查毛匪澤東，為國家叛徒，而大林眷村公廁，為多數人出入之場所，被告徐禮藩於該廁所內書寫上開反動文字，顯然有利於匪幫，核其所為，應構成以文字為有利於叛徒之宣傳罪，其先後三次為之，係基於概括犯意，反覆實施，自屬連續犯，惟念其家境坎坷，心情不穩，且在偵察中坦承犯罪，爰依法酌減其刑，並褫奪公權，獲案載有反動文字之木板三塊，便條一張均係違禁物，依法均應沒收。\n三、據上論結，應依軍事審判法第一百七十三條前段，懲治叛亂條例第十條後段，第七條，第十二條，刑法第五十六條前段，第卅七條第二項，第卅八條第一項第一款，第二項，第五十九條，判決如主文。\n四、本案經軍事檢察官臧家正到庭執行職務。\n中　華　民　國　六　十　三　年　八　月　十　三　日\n台灣警備總司令部普通審判庭\n審判長　王雲濤\n審判官　金振傑\n審判官　沈志純\n右判決正本證明與原本無異。\n如不服本判決，應於送達後十日內以文書提出於本部聲請覆判。\n中　華　民　國　六　十　三　年　八　月　十　二　日\n書記官　傅國光\n附錄本案論罪科刑法條全文\n懲治叛亂條例：\n第七條\t以文字為有利於叛徒之宣傳者，處七年以上有期徒刑。\n刑法：\n第卅七條第二項　宣告六月以上有期徒刑，依犯罪之性質認為有褫奪公權之必要者，宣告褫奪公權一年以上十年以下。"
}