{
    "id": "16967",
    "name": "林斗",
    "gender": "男",
    "birth_h": "1905",
    "province": "臺灣省",
    "city": "高雄市",
    "edu": "暫無資料",
    "d1_num": "暫無資料",
    "occupation": "工",
    "age": "45",
    "d1_per1": "暫無資料",
    "d1_crime1": "暫無資料",
    "d1_crime1cat": "暫無資料",
    "d1_law1": "暫無資料",
    "d1_prosec": "無",
    "d1_pa1": "暫無資料",
    "d1_clk1": "暫無資料",
    "d2_doc": "判決書",
    "d2_num1": "(39)安澄字第1679號",
    "d2_authority": "台灣省保安司令部",
    "d2_main1": "參加叛亂組織",
    "d2_term": "有",
    "d2_termy": "5",
    "d2_termm": "0",
    "d2_law1": "懲治叛亂條例",
    "d2_law1a": "5",
    "d2_law2": "刑法",
    "d2_law2a": "59",
    "d2_j1": "范明",
    "d2_jpos1": "審判官",
    "d2_clk1": "王壽堂",
    "d2_y": "39",
    "d2_m": "6",
    "d2_d": "30",
    "d2_rejud": "無",
    "f_authority": "台灣省保安司令部",
    "f_jyear": "39",
    "f_num": "(39)安澄字第1679號",
    "f_main1": "參加叛亂組織",
    "f_law1": "懲治叛亂條例",
    "f_law1a": "5",
    "f_law2": "刑法",
    "f_law2a": "59",
    "f_penaltytxt": "有期徒刑5年",
    "f_term": "有",
    "f_termy": "5",
    "f_termm": "0",
    "f_forf": "無",
    "f_j1": "范明",
    "f_clk1": "王壽堂",
    "f_y": "39",
    "f_m": "6",
    "f_d": "30",
    "f_txt": "【裁判字號】39，安澄，1679\n【裁判日期】39\n【裁判機關】臺灣省保安司令部\n【受裁判者】林斗\n【類　　別】判決書\n【裁判全文】\n\n臺灣省保安司令部判決　　　　　　　　　　　　　　　　　　　     (39)安澄字第１６７９號\n判決正本\n被　告　林  斗  男  年四十五歲 高雄市人  業工\n右列被告因參加叛亂組織案件本部判決如左：\n　　主文\n林斗參加叛亂組織處有期徒刑五年\n　　事實\n林斗為東台糖廠機工于三十七年七月間在鋁業公司服務時經肥料公司領班黃有才介紹參加職工聯盟事經本部保安處查悉於三十八年十一月間將之拘解到部\n　　理由\n本件被告林斗對于參加職工聯盟一節在本處固矢口否認其事惟查該被告于三十九年四月三十日在本部保安處偵訊時曾自白「于三十七年七月經肥料公司領班黃有才介紹參加職工聯盟並交納會費參加者有十六人其主旨是集體聯合要求待遇大」等語記錄在卷縱事後空言狡賴仍難解其刑責按職工聯盟為其匪外圍組織應認為叛亂團體從而該被告即應依參加叛亂組織論罪第查該被告身為勞工未受教育其參加　受人之懲恿純屬盲從情堪憫恕姑以低度刑減輕科處以啟自新\n據上論結合依戒嚴法第八條第二項條正懲治叛亂條例第一條第 第五條第十二條刑法第五十九條第六十六條前段刑事訴訟法第二條第九十一條前段判決如主文\n中　華　民　國　三　十　九　年　六　月　三　十　日\n台灣省保安司令部軍法處\n審判官　范　明\n右正本證明與原本無異\n書記官　王壽堂\n中　華　民　國　三　十　九　年　　月　　日"
}