{
    "id": "17830",
    "name": "張就齒",
    "gender": "男",
    "province": "福建",
    "city": "惠安縣",
    "edu": "暫無資料",
    "d1_num": "暫無資料",
    "occupation": "反共救國軍第41支隊炊事員",
    "age": "38",
    "d1_per1": "暫無資料",
    "d1_crime1": "暫無資料",
    "d1_crime1cat": "暫無資料",
    "d1_law1": "暫無資料",
    "d1_prosec": "無",
    "d1_pa1": "暫無資料",
    "d1_clk1": "暫無資料",
    "d2_doc": "判決書",
    "d2_num1": "(43)審字第018號",
    "d2_authority": "福建省反共救國軍總指揮部",
    "d2_pa1": "張復",
    "d2_atty1": "王君毅",
    "d2_attycat": "公設",
    "d2_main1": "共同為叛徒運輸供使用物資",
    "d2_per1": "張老佩",
    "d2_per2": "張大鴿",
    "d2_per3": "張相款",
    "d2_term": "有",
    "d2_termy": "5",
    "d2_termm": "0",
    "d2_dpriv": "有",
    "d2_dprivy": "5",
    "d2_dprivm": "0",
    "d2_law1": "懲治叛亂條例",
    "d2_law1a": "4",
    "d2_law1s": "1",
    "d2_law1i": "4",
    "d2_law2": "刑法",
    "d2_law2a": "59",
    "d2_j1": "林湖舫",
    "d2_j2": "張垚",
    "d2_j3": "張亮熙",
    "d2_jpos1": "審判長",
    "d2_jpos2": "審判官",
    "d2_jpos3": "審判官",
    "d2_clk1": "馬宗輝",
    "d2_y": "43",
    "d2_m": "3",
    "d2_d": "8",
    "d2_rejud": "無",
    "f_authority": "福建省反共救國軍總指揮部",
    "f_jyear": "43",
    "f_num": "(43)審字第18號",
    "f_pa1": "張復",
    "f_atty1": "王君毅",
    "f_attycat": "公設",
    "f_main1": "共同為叛徒運輸供使用物資",
    "f_per1": "張老佩",
    "f_per2": "張大鴿",
    "f_per3": "張相款",
    "f_law1": "懲治叛亂條例",
    "f_law1a": "4",
    "f_law1s": "1",
    "f_law1i": "4",
    "f_law2": "刑法",
    "f_law2a": "59",
    "f_penaltytxt": "有期徒刑5年，褫奪公權5年",
    "f_term": "有",
    "f_termy": "5",
    "f_termm": "0",
    "f_forf": "無",
    "f_j1": "林湖舫",
    "f_j2": "張垚",
    "f_j3": "張亮熙",
    "f_clk1": "馬宗輝",
    "f_y": "43",
    "f_m": "3",
    "f_d": "8",
    "f_txt": "【裁判字號】43，審，0018\n【裁判日期】430308\n【裁判機關】福建省反共救國軍總指揮部\n【受裁判者】張大鴿，張就齒，張相欵，張老佩\n【類　　別】判決書\n【裁判全文】\n\n福建省反共救國軍總指揮部判決 　　　　　　　　　　　　    　　　四十三年度審字第十八號\n公訴人本部軍事檢察官\n被告  張大鴿  男年二十二歲  福建省惠安縣人  本部四十一支隊操舟組隊員（在押）\n　張就齒  男年三十八歲  福建省惠安人  本部四十一支隊炊事員\n　張相欵  男年十九歲  福建省惠安縣人  本部南海廾二支隊第一大隊第一中隊隊員\n　　張老佩  男年二十七歲  福建省惠安縣人  本部南海廾一支隊第一大隊第一中隊隊員\n公設辯護人王君毅\n右被告等因為匪運輸一案經軍事檢察官提起公訴本部判決如左\n　　主文\n張大鴿張老佩張相欵張就齒共同為匪叛徒運輸各處有期徒刑五年褫奪公權五年\n全部財產除酌留其家屬必須生活費外沒收\n　　事實\n張大鴿係本部四十一支隊操舟組隊員曾於民國四十年十一月間結夥逃亡投往匪區後即同張老佩張相欵張就齒張先宗張　川等合夥操舟為生於四十一年農曆十二月二十八日為匪崇武合作社運儎白米壹百伍拾包自石碼前往崇武途經惠安縣轄塔曲頭地方被我軍查輯並將張老佩張相欵張就齒張先宗張　川等五人一併俘獲除張先宗張　川二人以年老遣回外張大鴿等四名編入本部服役張大鴿逃亡部分由金門防衛司令部判處外被告張大鴿張就齒張相欵張老佩等為匪運輸部分　　　　　　經軍事檢察官偵查起訴移付審判\n理由\n按國防部軍法局四十三年　　　　　　　　　　　區人民為匪偽運輸物資如非出於　　　　　觸犯懲治叛亂條例第四條第一項第四款之罪本案被告張大鴿張相欵張老佩張就齒等對於為叛徒運輸一節均供認不諱被告張大鴿雖辯稱：「運米事不是我接洽的至米裝船時見蔴袋上有「崇武合作社」字樣才曉得這米是共匪的我是水手不能主張拒運」等語但訊據被告張就齒供稱：「不替匪運輸是可以的但為了吃飯所以要運的」這船是六人合夥所以運費除由船主抽四成外餘均分被告張相欵張老佩均供稱：「當運米時知道這米是共匪合作社的在大陸不運吃什麼但不替他（匪）運輸也可以的只運這一次匪沒有迫我運」各等與共同被告不利於己之陳述得採為證據最高法院著有判例自難 其展卸是被告等實無受匪所迫而為運輸已臻明確依上開軍法局代電自應依法論處唯念被告等在匪區生活困苦知識譾陋更因鐵幕低垂無從獲得愛國抗暴教育致誤罹法網核情不無可憫愛與減處以啟自就至被告張先宗張　川二名俟緝獲後另行法辦合併說明\n據上論結應依戰時陸海空軍審判簡易規程第二條第一第一項第一款後段刑事訴訟法第二百九十一條前段懲治叛亂條例第四條第一項第四款第八條第一項第十條第十二條刑法第十一條第三十七條第二項第五十九條判決如主文\n本案經軍事檢察官張 復蒞庭執行職務\n中　華　民　國　四　十　三　年　三　月　二 日\n福建省反共救國軍總指揮部軍法合議庭\n審判長　林湖舫\n審判官　張　垚\n張亮熙\n中　華　民　國　四　十　三　年　三　月　八　日\n　　本件證實與原本無異\n書記官　馬宗輝\n"
}