{
    "id": "19360",
    "name": "趙榮璋",
    "gender": "男",
    "birth_h": "1927",
    "province": "臺灣省",
    "city": "高雄縣",
    "edu": "暫無資料",
    "d1_num": "暫無資料",
    "occupation": "照相館學徒",
    "age": "24",
    "d1_per1": "暫無資料",
    "d1_crime1": "暫無資料",
    "d1_crime1cat": "暫無資料",
    "d1_law1": "暫無資料",
    "d1_prosec": "無",
    "d1_pa1": "暫無資料",
    "d1_clk1": "暫無資料",
    "d2_doc": "判決書",
    "d2_num1": "(39)安潔字第2803號",
    "d2_authority": "台灣省保安司令部",
    "d2_main1": "參加叛亂之組織",
    "d2_per1": "林來安",
    "d2_per2": "張聰哲",
    "d2_term": "有",
    "d2_termy": "5",
    "d2_termm": "0",
    "d2_dpriv": "有",
    "d2_dprivy": "3",
    "d2_dprivm": "0",
    "d2_law1": "懲治叛亂條例",
    "d2_law1a": "5",
    "d2_law2": "刑法",
    "d2_law2a": "59",
    "d2_j1": "周咸慶",
    "d2_jpos1": "審判官",
    "d2_clk1": "鄭和生",
    "d2_y": "39",
    "d2_m": "11",
    "d2_d": "14",
    "d2_rejud": "無",
    "f_authority": "台灣省保安司令部",
    "f_jyear": "39",
    "f_num": "(39)安潔字第2803號",
    "f_main1": "參加叛亂之組織",
    "f_group": "台灣青年獨立自由黨",
    "f_per1": "林來安",
    "f_per2": "張聰哲",
    "f_law1": "懲治叛亂條例",
    "f_law1a": "5",
    "f_law2": "刑法",
    "f_law2a": "59",
    "f_penaltytxt": "有期徒刑5年",
    "f_term": "有",
    "f_termy": "5",
    "f_termm": "0",
    "f_forf": "無",
    "f_j1": "周咸慶",
    "f_clk1": "鄭和生",
    "f_y": "39",
    "f_m": "11",
    "f_d": "14",
    "f_txt": "【裁判字號】39，安潔，2803\n【裁判日期】391107\n【裁判機關】台灣省保安司令部\n【受裁判者】林來安、趙榮璋、張聰哲\n【類　　別】判決書\n【裁判全文】\n\n台灣省保安司令部判決　　　　　　　　　　　　　　　　　　　 （３９）安潔字第２８０３號\n    判決正本\n被　告　林來安　男　年二十四歲　高雄市人　省立工學院建築工程系三年級學生\n　　　　趙榮璋　男　年廿四歲　　高雄縣人　業照相館學徒\n　　　　張聰哲　男　年二十一歲　台南縣人　無業\n右被告等因犯叛亂罪一案經本部判決如左\n　　主文\n林來安趙榮璋張聰哲參加叛亂之組織各處有期徒刑五年各褫奪公權三年\n　　事實\n林來安自三十五年九月與在逃之陳文山認識為台南長榮中學讀書方便於同年十月搬進陳文山家居趙榮璋亦因在長榮中學讀書借宿該陳文山家在三十六年元月間趙榮璋之同學張聰哲來訪該陳文山乘林來安趙榮璋張聰哲等人間談之際入室向彼等批評政府如何腐販台灣青年應團結奮鬥爭取獨立倡議組織台灣青年獨立自由黨煽惑彼等參加其後討論二三次尚未辦理參加手續經同學勸解趙榮璋等始知陳文山所等設者為非法組織於同年三月間相率搬離與陳文山斷絕來往亦未為其他不法工作事經台灣省警務處刑警總隊獲悉將該林來安趙榮璋張聰哲三名拘捕層解到部法辦案經審明合予判決\n\t理由\n本件被告林來安趙榮璋張聰哲對於三十六年元月間由在逃之陳文山倡組台灣青年獨\n　　　　　　被告等參加以反抗政府爭取獨立自由之事實雖矢口否認參加但該被告等既供認該陳文山確曾批評政府腐敗倡組台灣青年獨立自由黨並核被告等於刑警總隊及本部保安處偵訊时供明參加在卷且被告張聰哲常與已參加聯合獨立黨之嘉義商職學生羅安西來往其否認參加非法組織顯屬狡卸刑責核其所為應各依參加叛亂組織罪處斷惟查該被告等參加時間短暫後知為非法即與陳文山斷絕來往其他尚無為匪工作事後深具悔悟情尚可憫爱各予減處以示矜卹基上論結陳羅安西另案辦理陳文山俟獲案後審結外合依修正懲治叛亂條例第十條第五條第十二條刑法第五十九條第七十三條第六十六條第三十七條第六項刑事訴訟法第二百九十一條前段判決如主文\n中　華　民　國　三　十　九　年　十　一　月　　七　　日\n台灣省保安司令部軍法處\n審判官　周咸慶\n右正本證明與原本無異\n書記官　鄭和生\n中　華　民　國　三　十　九　年　十　一　月　十　四　日\n"
}