{
    "id": "21514",
    "name": "黃自清",
    "gender": "男",
    "birth_h": "1915",
    "province": "江蘇",
    "city": "常熟縣",
    "edu": "暫無資料",
    "d1_num": "暫無資料",
    "occupation": "月眉糖廠佐理員",
    "age": "37",
    "d1_per1": "暫無資料",
    "d1_crime1": "暫無資料",
    "d1_crime1cat": "暫無資料",
    "d1_law1": "暫無資料",
    "d1_prosec": "無",
    "d1_pa1": "暫無資料",
    "d1_clk1": "暫無資料",
    "d2_doc": "判決書",
    "d2_num1": "(41)安潔字第0577號",
    "d2_authority": "台灣省保安司令部",
    "d2_pa1": "曾豈凡",
    "d2_atty1": "陳慶粹",
    "d2_attycat": "公設",
    "d2_main1": "故意陷害誣告他人參加叛亂之集會",
    "d2_term": "有",
    "d2_termy": "5",
    "d2_termm": "0",
    "d2_law1": "刑法",
    "d2_law1a": "55",
    "d2_law2": "檢肅匪諜條例",
    "d2_law2a": "10",
    "d2_law2s": "1",
    "d2_law3": "檢肅匪諜條例",
    "d2_law3a": "10",
    "d2_law3s": "3",
    "d2_law4": "懲治叛亂條例",
    "d2_law4a": "5",
    "d2_j1": "甘勵行",
    "d2_jpos1": "審判官",
    "d2_clk1": "徐松泉",
    "d2_y": "41",
    "d2_m": "2",
    "d2_d": "20",
    "d2_rejud": "無",
    "f_authority": "台灣省保安司令部",
    "f_jyear": "41",
    "f_num": "(41)安潔字第0577號",
    "f_pa1": "曾豈凡",
    "f_atty1": "陳慶粹",
    "f_attycat": "公設",
    "f_main1": "故意陷害誣告他人參加叛亂之集會",
    "f_law1": "刑法",
    "f_law1a": "55",
    "f_law2": "檢肅匪諜條例",
    "f_law2a": "10",
    "f_law2s": "1",
    "f_law3": "檢肅匪諜條例",
    "f_law3a": "10",
    "f_law3s": "3",
    "f_law4": "懲治叛亂條例",
    "f_law4a": "5",
    "f_penaltytxt": "有期徒刑5年",
    "f_term": "有",
    "f_termy": "5",
    "f_termm": "0",
    "f_forf": "無",
    "f_j1": "甘勵行",
    "f_clk1": "徐松泉",
    "f_y": "41",
    "f_m": "2",
    "f_d": "20",
    "f_txt": "【裁判字號】41，安潔，0577\n【裁判日期】410220\n【裁判機關】台灣省保安司令部\n【受裁判者】黃自清\n【類　　別】判決書\n【裁判全文】\n\n台灣省保安司令部判決　　　　　　　　　　　　　　　　　　（４１）安潔字　　第○五七七號\n    公訴人　本部軍事檢察官\n被　告　黃自清　男年三十七歲   江蘇常熟縣人  住台中縣    業月眉糖廠佐理員\n指定辯護人　本部公設辯護人　陳慶粹\n右被告因誣告匪諜等案件經軍事檢察官提起公訴本部判決如左\n　　主　文\n黃自清故意陷誣告他人參加叛亂之集會處有期徒刑五年\n偽造信函乙件沒收\n　　事　實\n黃自清係台中縣月眉糖廠佐理員因與該廠總務課長鍾毓靈事務股長熊佳澄積有嫌　蓄意報復于上（四十）年十二月二日及十四日利用其化名陳立功名義向台灣省保安警察第二總　部密報鍾毓靈及熊佳澄等為匪秘密集會從事叛亂并偽造余天驥由匪區致熊佳澄內容曖昧信函乙件附於報告內以期達其誣陷之目的事為該總隊查明所告不實將黃目清扣解到部經軍事檢察官偵查起訴\n\t理　由\n本案被告黃自清對於因與台中縣月眉糖廠總務課長鍾毓靈事務股長熊佳澄有隙遂于上（四十）年十二月二日及十四日先後利用其化名陳立功名義向台灣省保安警察第二總隊報告其為匪秘密參加集會并偽造余天驥由匪致熊佳澄內容曖昧信函乙件附於報告內等事實業其供認不諱核與軍事檢察官偵查結果及台灣省保安警察第二總隊代電所報情形均屬相符并有被告親筆所書之報告及偽造原函附卷為據罪證明確堪資認定核其行為　觸犯偽造私交書并用以行使及誣告匪諜等罪惟偽造私文書　之低度行為已為行使之高度行為所吸收行使偽造私文書與誣告他人為匪諜復互有牽連關係應從一重以誣告匪諜罪論科查被告故意陷害誣告鍾毓靈熊佳澄等秘密參加會從事叛亂自應依誣告他人參加叛亂之集會罪刑論議第查被告罪後于所誣告之案件尚在偵查中在保警總隊及本部審訊時均坦白供承應予酌減其刑偽造余天驥私函乙件係供犯罪所用之物并應依法沒收\n據上論結應依戒嚴法第八條第一項第五款第二項刑事訴訟法第二百九十一條前段刑法第十一條前段第五十五條第二百十條第二百十六條第卅八條第一項第二款戡亂時期檢肅匪諜條例第十條第一項第三項懲治叛亂條例第五條判決如主文\n本　案　經　軍　事　檢　察　官　曾　豈　凡　庭　執　行　職　務\n中　　華　　民　　國　　四　　十　　一　　年　　二　　月　　十　　一　　日\n台灣省保安司令部軍法處\n審判官　甘勵行\n　　右正本證明與原本無異\n中　　華　　民　　國　　四　　十　　一　　年　　二　　月　　二　　十　　日\n書記官　徐松泉\n"
}