{
    "id": "21528",
    "name": "廖慶安",
    "gender": "男",
    "birth_h": "1932",
    "province": "臺灣省",
    "city": "宜蘭縣",
    "edu": "暫無資料",
    "d1_num": "暫無資料",
    "occupation": "農",
    "age": "20",
    "d1_per1": "暫無資料",
    "d1_crime1": "暫無資料",
    "d1_crime1cat": "暫無資料",
    "d1_law1": "暫無資料",
    "d1_prosec": "無",
    "d1_pa1": "暫無資料",
    "d1_clk1": "暫無資料",
    "d2_doc": "判決書",
    "d2_num1": "(40)安潔字第4077號",
    "d2_authority": "台灣省保安司令部",
    "d2_pa1": "顏忠魯",
    "d2_atty1": "張元傑",
    "d2_attycat": "公設",
    "d2_main1": "參加叛亂之組織",
    "d2_term": "有",
    "d2_termy": "5",
    "d2_termm": "0",
    "d2_dpriv": "有",
    "d2_dprivy": "5",
    "d2_dprivm": "0",
    "d2_law1": "懲治叛亂條例",
    "d2_law1a": "5",
    "d2_law2": "刑法",
    "d2_law2a": "59",
    "d2_j1": "周咸慶",
    "d2_jpos1": "審判官",
    "d2_clk1": "王蔭庭",
    "d2_y": "40",
    "d2_m": "11",
    "d2_d": "14",
    "d2_rejud": "無",
    "f_authority": "台灣省保安司令部",
    "f_jyear": "40",
    "f_num": "(40)安潔字第4077號",
    "f_pa1": "顏忠魯",
    "f_atty1": "張元傑",
    "f_attycat": "公設",
    "f_main1": "參加叛亂之組織",
    "f_law1": "懲治叛亂條例",
    "f_law1a": "5",
    "f_law2": "刑法",
    "f_law2a": "59",
    "f_penaltytxt": "有期徒刑5年",
    "f_term": "有",
    "f_termy": "5",
    "f_termm": "0",
    "f_forf": "無",
    "f_j1": "周咸慶",
    "f_clk1": "王蔭庭",
    "f_y": "40",
    "f_m": "11",
    "f_d": "14",
    "f_txt": "【裁判字號】40，安潔，4077\n【裁判日期】401114\n【裁判機關】台灣省保安司令部\n【受裁判者】廖慶安\n【類　　別】判決書\n【裁判全文】\n\n台灣省保安司令部判決　　　　　　　　　　　　　　　　　　　     (40)安潔字第四○七七號\n    公訴人　本部軍事檢察官\n被　告　廖慶安　男　年廿歲　宜蘭縣人　業農\n指定辯護人　本部公設辯護人　張元傑\n右被告因叛亂案件經軍事檢察官提起公訴本部判決如左\n　　主文\n廖慶安參加叛亂之組織處有期徒刑五年褫奪公權五年\n　　事實\n廖慶安於民國卅九年二月間由匪徒鄒朝松介紹參加共匪組織至同年四月鄒匪被捕時畏懼潛逃無蹤通緝有案於本（四十）年七月廿六日（古曆）向警局投案層解由本部軍事檢察官偵查起訴\n　　理由\n被告廖慶安對於民國卅九年二月間由匪徒鄒朝松介紹參加共匪組織之事實已自白在卷雖辯稱「卅九年清明節時鄒朝松強迫邀我吃酒并介紹認識姓黃姓李的二人騙我參加實未說明是共產黨後來我決心自首乃於四十年古曆七月廿六日擬向宜蘭縣自首途遇參議員李阿圳才徇他勸說改向三星鄉派出所投案」等語但查該被告先後在本部保安處及軍事檢察官有偵查時均供明在卷其抗辦顯不足採信惟未為匪工作係犯參加叛亂組織之罪責至辯稱自首一節查被告早經政府於卅九年四月間通緝有案遲於四十年古曆七月廿六日始行投案與自首要件不符要難邀自首之寬典次查被告於民國廿一年古曆十一月廿一日出生依照陰陽曆對照表核算為陽曆廿一年十二月十八日出生至卅九年二月犯罪時固未滿十八歲但其參加之叛亂組織有繼續性既未聲明脫離其犯罪行為顯仍在繼續狀態中至本（四十）年七月廿六日投案時已屬滿十八歲自勿庸減處姑念其年幼無知一時失察被誘參加而罹重典衡情可憫爰予依法減科以示矜卹\n據上論結應依刑事訴訟法第二百九十一條前段懲治叛亂條例第十條第五條第十二條刑法第五十九條第卅七條第二項判決如主文\n本案經軍事檢察官顏忠魯蒞庭執行職務\n中　華　民　國　四　十　年　十　一　月　七　日\n台灣省保安司令部軍法處\n審判官　周咸慶\n右正本證明與原本無異\n中　華　民　國　四　十　年　十　一　月　十　四　日\n書記官　王蔭庭"
}