{
    "id": "21571",
    "name": "詹鴻堦",
    "gender": "男",
    "birth_h": "1918",
    "province": "臺灣省",
    "city": "苗栗縣",
    "edu": "暫無資料",
    "d1_num": "暫無資料",
    "occupation": "農林廳檢驗局新竹分局工友",
    "age": "35",
    "d1_per1": "暫無資料",
    "d1_crime1": "暫無資料",
    "d1_crime1cat": "暫無資料",
    "d1_law1": "暫無資料",
    "d1_prosec": "無",
    "d1_pa1": "暫無資料",
    "d1_clk1": "暫無資料",
    "d2_doc": "判決書",
    "d2_num1": "(41)安潔字第2921號",
    "d2_authority": "台灣省保安司令部",
    "d2_pa1": "杜峻嶺",
    "d2_atty1": "張元傑",
    "d2_attycat": "公設",
    "d2_main1": "明知為匪諜而不告密檢舉",
    "d2_term": "有",
    "d2_termy": "5",
    "d2_termm": "0",
    "d2_law1": "檢肅匪諜條例",
    "d2_law1a": "9",
    "d2_j1": "范明",
    "d2_jpos1": "審判官",
    "d2_clk1": "呂秀瀛",
    "d2_y": "41",
    "d2_m": "10",
    "d2_d": "18",
    "d2_rejud": "無",
    "f_authority": "台灣省保安司令部",
    "f_jyear": "41",
    "f_num": "(41)安潔字第2921號",
    "f_pa1": "杜峻嶺",
    "f_atty1": "張元傑",
    "f_attycat": "公設",
    "f_main1": "明知為匪諜而不告密檢舉",
    "f_law1": "檢肅匪諜條例",
    "f_law1a": "9",
    "f_penaltytxt": "有期徒刑5年",
    "f_term": "有",
    "f_termy": "5",
    "f_termm": "0",
    "f_forf": "無",
    "f_j1": "范明",
    "f_clk1": "呂秀瀛",
    "f_y": "41",
    "f_m": "10",
    "f_d": "18",
    "f_txt": "【裁判字號】41，安潔，2921\n【裁判日期】411018\n【裁判機關】台灣省保安司令部\n【受裁判者】詹鴻堦\n【類　　別】判決書\n【裁判全文】\n\n台灣省保安司令部判決　　　　　　　　　　　　　　　　　　　     (41)安潔字第二九二一號\n    公訴人　本部軍事檢察官\n被　告　詹鴻堦　男　年卅五歲　苗栗縣人　農林廳檢驗局新竹分局工友\n指定辯護人　本部公設辯護人　張元傑\n右被告因違反檢肅匪諜案件經軍事檢察官提起公訴本部判決如左\n　　主文\n詹鴻堦明知為匪諜而不告密檢舉處有期徒刑五年\n　　事實\n詹鴻堦與在逃匪諜施儒珍在農林廳檢驗局新竹分局有同事之誼民國四十年六月間匪新竹市委會書記黃樹滋被捕施匪即畏罪潛匿於同月中旬曾至另案被告楊進發家中囑渠至卓蘭鄉該詹鴻堦家中探詢有無工作並告知施儒珍因犯共產黨案件在逃請設法予以安身之處楊進發將情轉達後該詹鴻堦雖未即應允但亦未據向治安機關告密檢舉案經保密局查獲解辧過部經軍事檢察官偵察起訴\n　　理由\n查被告詹鴻堦於民國四十年六月十五日曾接見自稱林姓者至其家謂係施儒珍所介紹來者詢以有無工作並告以施儒珍因犯共產黨案件在逃亡中被政府查緝盼為之設法找一安身之處但未允其所請答以卓蘭軍警常常檢查戶口無法為之設法等事實業據該被告在保密局偵察時供認不諱核與被告楊進發在另案供述情形互相脗合是該被告明知施儒珍為匪諜之事證以臻明確堪以確定關於參加叛亂組織一節訊據該被告堅不承認經查亦乏積極佐證可資認定雖被告楊進發在偵查中曾供述施儒珍有囑其將政府要抓詹鴻堦叫他注意之事告知詹鴻堦等語微論被告詹鴻堦矢口否認其事縱令屬實仍不足以證明該被告確已參加叛亂之組織惟該被告明知施儒珍為匪諜而不告密檢舉自應依法處以相當之刑軍事檢查官起訴法條爰予變更\n據上論結應依刑事訴訟法第二百九十一條前段第二百九十二條戒嚴法第八條第二項戡亂時期檢肅匪諜條例第九條判決如主文\n本案經軍事檢察官杜峻嶺蒞庭執行職務\n中　華　民　國　四　十　一　年　十　月　十　三　日\n台灣省保安司令部軍事法庭\n審判官　范　明\n右正本證明與原本無異\n書記官　呂秀瀛\n中　華　民　國　四　十　一　年　十　月　十　八　日\n\n"
}