{
    "id": "21602",
    "name": "嚴丁枝",
    "gender": "男",
    "birth_h": "1908",
    "province": "臺灣省",
    "city": "苗栗縣",
    "edu": "暫無資料",
    "d1_num": "暫無資料",
    "occupation": "農",
    "age": "45",
    "d1_per1": "暫無資料",
    "d1_crime1": "暫無資料",
    "d1_crime1cat": "暫無資料",
    "d1_law1": "暫無資料",
    "d1_prosec": "無",
    "d1_pa1": "暫無資料",
    "d1_clk1": "暫無資料",
    "d2_doc": "判決書",
    "d2_num1": "(41)安潔字第3060號",
    "d2_authority": "台灣省保安司令部",
    "d2_pa1": "顏忠魯",
    "d2_atty1": "張元傑",
    "d2_attycat": "公設",
    "d2_main1": "連續藏匿叛徒",
    "d2_per1": "邱寶貴",
    "d2_per2": "江清華",
    "d2_term": "有",
    "d2_termy": "12",
    "d2_termm": "0",
    "d2_dpriv": "有",
    "d2_dprivy": "10",
    "d2_dprivm": "0",
    "d2_law1": "懲治叛亂條例",
    "d2_law1a": "4",
    "d2_law1s": "1",
    "d2_law1i": "7",
    "d2_law2": "刑法",
    "d2_law2a": "56",
    "d2_j1": "周咸慶",
    "d2_jpos1": "審判官",
    "d2_clk1": "王蔭庭",
    "d2_y": "41",
    "d2_m": "11",
    "d2_d": "10",
    "d2_rejud": "無",
    "f_authority": "台灣省保安司令部",
    "f_jyear": "41",
    "f_num": "(41)安潔字第3060號",
    "f_pa1": "顏忠魯",
    "f_atty1": "張元傑",
    "f_attycat": "公設",
    "f_main1": "連續藏匿叛徒",
    "f_per1": "邱寶貴",
    "f_per2": "江清華",
    "f_law1": "懲治叛亂條例",
    "f_law1a": "4",
    "f_law1s": "1",
    "f_law1i": "7",
    "f_law2": "刑法",
    "f_law2a": "56",
    "f_penaltytxt": "有期徒刑12年",
    "f_term": "有",
    "f_termy": "12",
    "f_termm": "0",
    "f_forf": "有",
    "f_j1": "周咸慶",
    "f_clk1": "王蔭庭",
    "f_y": "41",
    "f_m": "11",
    "f_d": "10",
    "f_txt": "【裁判字號】41，安潔，3060\n【裁判日期】411110\n【裁判機關】台灣省保安司令部\n【受裁判者】邱寶貴、嚴丁枝、江清華\n【類　　別】判決書\n【裁判全文】\n\n台灣省保安司令部判決　　　　　　　　　　　　　　　　　　　     (41)安潔字第三○六○號\n    公訴人　本部軍事檢察官\n被　告　邱寶貴　男　年四十一歲　苗栗縣人　業農\n　　　　嚴丁枝　男　年四十五歲　苗栗縣人　業農\n　　　　江清華　男　年卅一歲　  苗栗縣人　  業工\n指定共同辯護人　本部公設辯護人　張元傑\n右被告等因叛亂等案件經軍事檢察官提起公訴本部判決如左\n　　主文\n邱寶貴嚴丁枝連續藏匿叛徒處有期徒刑十二年各褫奪公權十年全部財產除各酌留其家屬必需生活費外均沒收\n江清華明知匪諜而不告密檢舉處有期徒刑二年\n　　事實\n邱寶貴于民國卅九年底起至四十一年初先後容留叛徒林元枝吳敦仁及在逃叛徒廖萬德等在家食宿數次嚴丁枝于民國四十年九月中旬曾留吳敦仁膳宿兩次各連續藏匿叛徒江清華在邱寶貴家傭工見林元枝吳敦仁等常率同叛徒來家寄宿明知為叛徒而不告密檢舉案經本部查獲解由軍事檢察官偵查起訴\n　　理由\n被告邱寶貴對於民國卅九年底至四十一年初間曾先後容留另案被告林元枝吳敦仁及在逃之廖萬德等食宿數次被告嚴丁枝對於民國四十年九月中旬容留吳敦仁食宿兩次及被告江清華對於眼見林元枝吳敦仁等寄宿被告邱寶貴家等事實業據分別供認不諱惟均否認明知林元枝吳敦仁廖萬德等為叛徒并辯稱無故意藏匿之意思亦不知告密檢舉之義務等語第據另案被告林元枝吳敦仁等分別當庭具結供明該被告等均知其為叛徒身分屬實是被告等既不能提出積極反證妄以空言狡卸其抗辯不足採信綜上所述被告邱寶貴嚴丁枝既明知林元枝吳敦仁等為叛徒而先後容留食宿數次均應依連續藏匿叛徒罪處斷核其所為惡性雖大固應從重懲處念其鄉愚無知且僅容留食宿尚無與匪發生組織關係及其他工作表現仍予酌情量處其全部財產除酌留其家屬必需生活費外均沒收被告江清華查尚無參加叛亂組織亦無藏匿叛徒其在被告邱寶貴家傭工時明知來邱家寄宿之林元枝吳敦仁等為叛徒而竟不告密檢舉自應依法酌情科處\n據上論結應依刑事訴訟法第二百九十一條前段懲治叛亂條例第十條後段第四條第一項第七款第八條第一項第十二條戒嚴法第八條第二項戡亂時期檢肅匪諜條例第九條刑法第五十六條第卅七條第二項判決如主文\n本案經軍事檢察官顏忠魯蒞庭執行職務\n中　華　民　國　四　十　一　年　十　一　月　三　日\n台灣省保安司令部軍事法庭\n審判官　周咸慶\n右正本證明與原本無異\n中　華　民　國　四　十　一　年　十　一　月　十　日\n書記官　王蔭庭\n"
}