{
    "id": "21609",
    "name": "張漢維",
    "gender": "男",
    "birth_h": "1906",
    "province": "臺灣省",
    "city": "苗栗縣",
    "edu": "暫無資料",
    "d1_num": "暫無資料",
    "occupation": "農",
    "age": "46",
    "d1_per1": "暫無資料",
    "d1_crime1": "暫無資料",
    "d1_crime1cat": "暫無資料",
    "d1_law1": "暫無資料",
    "d1_prosec": "無",
    "d1_pa1": "暫無資料",
    "d1_clk1": "暫無資料",
    "d2_doc": "判決書",
    "d2_num1": "(41)安潔字第1996號",
    "d2_authority": "台灣省保安司令部",
    "d2_pa1": "曾豈凡",
    "d2_atty1": "蕭與規",
    "d2_attycat": "公設",
    "d2_main1": "明知為匪諜而不告密檢舉",
    "d2_term": "有",
    "d2_termy": "1",
    "d2_termm": "0",
    "d2_law1": "檢肅匪諜條例",
    "d2_law1a": "9",
    "d2_j1": "王名馴",
    "d2_jpos1": "審判官",
    "d2_clk1": "杜蔭桐",
    "d2_y": "41",
    "d2_m": "6",
    "d2_d": "20",
    "d2_rejud": "無",
    "f_authority": "台灣省保安司令部",
    "f_jyear": "41",
    "f_num": "(41)安潔字第1996號",
    "f_pa1": "曾豈凡",
    "f_atty1": "蕭與規",
    "f_attycat": "公設",
    "f_main1": "明知為匪諜而不告密檢舉",
    "f_law1": "懲治叛亂條例",
    "f_law1a": "9",
    "f_penaltytxt": "有期徒刑1年",
    "f_term": "有",
    "f_termy": "1",
    "f_termm": "0",
    "f_forf": "無",
    "f_j1": "王名馴",
    "f_clk1": "杜蔭桐",
    "f_y": "41",
    "f_m": "6",
    "f_d": "20",
    "f_txt": "【裁判字號】41，安潔，1996\n【裁判日期】410620\n【裁判機關】台灣省保安司令部\n【受裁判者】張漢維\n【類　　別】判決書\n【裁判全文】\n\n台灣省保安司令部判決　　　　　　　　　　　　　　　　　　　     (41)安潔字第一九九六號\n    公訴人　本部軍事檢察官\n被　告　張漢維　男　年四十六歲　苗栗縣人　業農\n指定辯護人　本部公設辯護人　蕭與規\n右被告因違反檢肅匪諜案件經軍事檢察官起訴本部判決如左\n　　主文\n張漢維明知為匪諜而不告密檢舉處有期徒刑一年\n　　事實\n張漢維與自首匪諜李旺秀為同村居鄰卅八年十一月間李旺秀向張漢維宣講共黨好處勸其加入張允考慮四十年十一月間李旺秀同苗栗縣警察局自首說明前情該警局以張漢維有明知匪諜而不告密檢舉之嫌飭田南莊分駐所前往逮捕適張漢維於派捕人員返所後到該所準備報告有關李旺秀之前開各情遂被扣送苗栗縣警察局轉解本部軍事檢察官偵查起訴\n　　理由\n查匪諜自首份子李旺秀曾於卅八年十一月間向被告張漢維宣講共黨好處勸其參加經允考慮等情已為被告張漢維供認不爭之事實雖被告張漢維對於明知李旺秀為匪諜之點矢口否認且稱于村民大會主席報告：「如知有共黨或　共黨好話的人須隨時向警局報告」後即向該南莊警察分駐所警員葉某報告前開有關李旺秀之事實以為抗辯云云但查匪諜自首份子李旺秀與被告張漢維既係近鄰又對其宣講共黨好處勸其加入組織其顯係共黨份子乃一　人主觀上可以　認之事被告張漢維徒托空言否認具有明知殊難採信又經飭據苗栗縣警察局四十一年六月八日苗警刑政機字第二六四號代電復稱因匪諜李旺秀向該局自首據悉被告涉嫌重大派員逮捕事在被告張漢維赴該南莊分駐所被扣之前且被告張漢維並未有向葉警員報告有關李旺秀為匪情事等情則被告張漢維明知李旺秀為匪諜而未告密檢舉事證已極明確自不能卸劫職責惟查被告張漢維鄉愚無知自首份子李旺秀於卅八年十一月間向其勸誘時戡亂時期檢肅匪諜條例尚未頒佈迨頒佈後又因居處鄉僻或有不能盡悉之處延誤告密檢舉致觸刑章應予酌情從輕科處\n據上論結應依戒嚴法第八條第二項刑事訴訟法第二百九十一條前段戡亂時期檢肅匪諜條例第九條判決如主文\n本案經軍事檢察官曾豈凡蒞庭執行職務\n中　華　民　國　四　十　一　年　六　月　十　四　日\n台灣省保安司令部軍事法庭\n審判官　王名馴\n右正本證明與原本無異\n中　華　民　國　四　十　一　年　六　月　二　十　日\n書記官　杜蔭桐\n"
}