{
    "id": "22972",
    "name": "丁增壽",
    "gender": "男",
    "birth_h": "1922",
    "province": "江蘇",
    "city": "高郵縣",
    "edu": "暫無資料",
    "d1_num": "暫無資料",
    "occupation": "台北市黨部幹事",
    "age": "32",
    "d1_per1": "暫無資料",
    "d1_crime1": "暫無資料",
    "d1_crime1cat": "暫無資料",
    "d1_law1": "暫無資料",
    "d1_prosec": "無",
    "d1_pa1": "暫無資料",
    "d1_clk1": "暫無資料",
    "f_authority": "台灣省保安司令部",
    "f_jyear": "41",
    "f_num": "(41)安澄字第4247號",
    "f_pa1": "端木棪",
    "f_attycat": "暫無資料",
    "f_main1": "暫無資料",
    "f_group": "暫無資料",
    "f_per1": "暫無資料",
    "f_law1": "暫無資料",
    "f_penaltytxt": "不付軍法審判",
    "f_j1": "無",
    "f_clk1": "宋定亞",
    "f_txt": "【裁判字號】41，安澄，4247\n【裁判日期】411023\n【裁判機關】台灣省保安司令部\n【受裁判者】盧爾嫻、丁增壽\n【類　　別】判決書\n【裁判全文】\n\n台灣省保安司令部不付軍法裁決書　　　　　　　　　　　　　　（４１）安澄字第四二四七號\n　　被　告　\n盧爾嫻　女年二十六歲  江蘇寶應縣人  住基隆市  無業\n丁增壽　男年三十二歲  江蘇高郵縣人  住台北市  業台北市黨部幹事　　　　\n右被告等因叛亂罪嫌疑案件業經偵查終結認應不付軍法審判茲裁定如左\n　　主文\n盧爾嫻丁增壽均不付軍法審判　　\n　　理由\n被告盧爾嫻因有參加叛乱組織及明知乃夫范月樵為匪諜而不檢舉告密之嫌被告丁增壽因前在蘇北地區充當小學教員涉有為匪嫌疑經訊据被告盧爾嫻供称三十五年共匪佔据江蘇寶應縣有所謂婦女會者係在鄉村中邀集各家年在十八歲以上無兒童牽累之婦女在廣場開會由匪村長組長按戶呼喚渠亦數次被迫參加開會此外並無為匪担任工作情事至關於其夫范月樵為匪情形則不詳知范亦未曾將情向其說明等語訊据丁增壽供称原在江蘇界首鎮充當小學教員三十四年七月匪幫佔据首後仍在該鎮小學執教直至三十五年九月國軍收復界首鎮時則向党政府聯合辦事處登記自首云云核該被告等所供情節尚不能認定參加叛乱組織及有何為匪罪行即被告盧爾嫻亦不能証明其有明知匪諜而不檢舉告密情事犯罪嫌疑不足合依惩治叛乱條例第十條刑事訴訟法第　　　第十款裁決如主文\n中　華　民　國　四　十　一　年　十　月　十　七　日\n軍事檢察官　端木棪\n右正本証明與原本無異\n中　華　民　國　四　十　一　年　十　月　二　十　三　日\n書記官　宋定亞"
}