{
    "id": "22981",
    "name": "林世欽",
    "gender": "男",
    "birth_h": "1921",
    "province": "福建",
    "city": "林森縣",
    "edu": "暫無資料",
    "d1_num": "暫無資料",
    "occupation": "員林防空監視哨中尉哨長",
    "age": "33",
    "d1_per1": "暫無資料",
    "d1_crime1": "暫無資料",
    "d1_crime1cat": "暫無資料",
    "d1_law1": "暫無資料",
    "d1_prosec": "無",
    "d1_pa1": "暫無資料",
    "d1_clk1": "暫無資料",
    "d2_doc": "判決書",
    "d2_num1": "(42)審三字第85號",
    "d2_authority": "台灣省保安司令部",
    "d2_pa1": "梅綬蓀",
    "d2_atty1": "羅鎮",
    "d2_attycat": "公設",
    "d2_main1": "將電信交通器材物品交付叛徒",
    "d2_term": "有",
    "d2_termy": "10",
    "d2_termm": "0",
    "d2_dpriv": "有",
    "d2_dprivy": "7",
    "d2_dprivm": "0",
    "d2_law1": "懲治叛亂條例",
    "d2_law1a": "4",
    "d2_law1s": "1",
    "d2_law1i": "1",
    "d2_j1": "王建國",
    "d2_j2": "邢炎初",
    "d2_j3": "王名馴",
    "d2_jpos1": "審判長",
    "d2_jpos2": "審判官",
    "d2_jpos3": "審判官",
    "d2_clk1": "陳道源",
    "d2_y": "42",
    "d2_m": "12",
    "d2_d": "1",
    "d2_rejud": "無",
    "f_authority": "台灣省保安司令部",
    "f_jyear": "42",
    "f_num": "(42)審三字第85號",
    "f_pa1": "梅綬蓀",
    "f_atty1": "羅鎮",
    "f_attycat": "公設",
    "f_main1": "將電信交通器材物品交付叛徒",
    "f_law1": "懲治叛亂條例",
    "f_law1a": "4",
    "f_law1s": "1",
    "f_law1i": "1",
    "f_penaltytxt": "有期徒刑10年",
    "f_term": "有",
    "f_termy": "10",
    "f_termm": "0",
    "f_forf": "有",
    "f_j1": "王建國",
    "f_j2": "邢炎初",
    "f_j3": "王名馴",
    "f_clk1": "陳道源",
    "f_y": "42",
    "f_m": "12",
    "f_d": "1",
    "f_txt": "【裁判字號】42，審三，0085\n【裁判日期】421201\n【裁判機關】台灣省保安司令部\n【受裁判者】林世欽\n【類　　別】判決書\n【裁判全文】\n\n台灣省保安司令部判決　　　　　　　　　　　　　　　　　　　         (42)審三字第八五號\n    公訴人　本部軍事檢察官\n被　告　林世欽　男　年卅三歲　福建林森縣人　業員林防空監視哨中尉哨長　在押\n指定辯護人　本部公設辯護人　羅 鎮\n右被告因叛亂案件經軍事檢察官提起公訴本部判決如左\n　　主文\n林世欽將電信交通器材物品交付叛徒處有期徒刑十年褫奪公權七年全部財產除酌留其家屬必需生活費用外沒收\n　　事實\n林世欽于民國卅八年八月間福州陷匪前任福建省保安司令部福州防空情報所少校所長因受附匪之禹能久煽惑憧憬匪幫寬大謊言又因家口牽累于福州陷匪時未能撤離將該所重要器材埋藏後迨匪陷該所時將較劣電話機三部及人員用具等造册移交匪方經匪結予班長名義領取救濟米月餘即被遣散卅九年初逃抵白犬島同年三月考取前第十二兵團軍事政治學校于五月間隨校來台事為空軍總司令部查悉扣解本部報奉　國防部授權審辦由軍事檢察官偵查提起公訴\n　　理由\n被告林世欽卅八年八月任福建保安司令部福州情報所長於該所陷匪時將電話機三部交匪之事實業據該被告于本部保安處及軍事檢察官偵查庭供認不諱先後一致錄供在卷可憑核與空軍總司令部調查情形亦相符合犯情自臻明確雖該被告于審理中辯係該所職員鄒友平造册移交等情但亦經傳據陳為銘到庭具結證稱福州陷匪後與該被告見面時該被告告知由其自己移交云云并經當庭質明在卷是該被告將電信交通器材物品交付叛徒之罪行自不容其空言諉卸惟查該被告因家口牽累一時失措未能撤離既據供稱已將重要較好器材埋藏僅將劣品電話機三部交匪情節尚可矜恕合予酌情依法從輕科處全部財產除酌留其家屬必需生活費用外沒收之\n據上論結應依戰時陸海空軍審判簡易規程第二條第一項前段第八條刑事訴訟法第二百九十一條前段懲治叛亂條例第十條後段第四條第一項第一款第八條第一項第七二條刑法第卅七條第二項判決如主文\n本案經軍事檢察官梅綬蓀蒞庭執行職務\n中　華　民　國　四　十　二　年　十　一　月　廿　四　日\n台灣省保安司令部軍法合議庭\n審判長　王建國\n審判官　邢炎初\n審判官　王名馴\n右正本證明與原本無異\n中　華　民　國　四　十　二　年　十　二　月　一　日\n書記官　陳道源"
}