{
    "id": "23056",
    "name": "劉宗正",
    "gender": "男",
    "birth_h": "1925",
    "province": "北平市",
    "edu": "暫無資料",
    "d1_num": "暫無資料",
    "occupation": "無",
    "age": "31",
    "d1_per1": "暫無資料",
    "d1_crime1": "暫無資料",
    "d1_crime1cat": "暫無資料",
    "d1_law1": "暫無資料",
    "d1_prosec": "無",
    "d1_pa1": "暫無資料",
    "d1_clk1": "暫無資料",
    "f_authority": "台灣省保安司令部",
    "f_jyear": "44",
    "f_num": "(44)審特字第0091號",
    "f_pa1": "范覺非",
    "f_atty1": "馬心聲",
    "f_attycat": "暫無資料",
    "f_main1": "暫無資料",
    "f_group": "暫無資料",
    "f_per1": "暫無資料",
    "f_law1": "暫無資料",
    "f_penaltytxt": "交付感化期間另以命令定之",
    "f_edu": "有",
    "f_eduy": "0",
    "f_edum": "0",
    "f_j1": "王名馴",
    "f_clk1": "管萃恩",
    "f_txt": "【裁判字號】44，審特，0091\n【裁判日期】450114\n【裁判機關】台灣省保安司令部\n【受裁判者】劉宗正\n【類　　別】判決書\n【裁判全文】\n\n台灣省保安司令部判決　　　　　　　　　　　　　　　　　　　         (44)審特字第九一號\n    公訴人　本部軍事檢察官\n被　告　劉宗正　男　年卅一歲　北平市人　住台北市　業無　在押\n指定辯護人　本部公設辯護人　馬心聲\n右被告因叛亂案件經軍事檢察官提起公訴本部判決如左\n　　主文\n劉宗正交付感化期間另以命令定之\n　　理由\n被告劉宗正於本（四四）年四月二日午後前往台北市南京東路一二五號陸軍總司令部李副總司令宅於傭人楊裕昌住室以匪幫「中國人民解放軍總指揮部」名義書寫致最高當局函一紙係陳停止戰爭進行和談釋放囚犯及與美國斷絕邦交等情雖已據供認不諱又有獲案原函附卷可憑且被告所辯該函係其前在台北市圖書館發現而照樣抄呈李副總司令察閱並非其冒用匪幫名義所寫等語經查該函首尾既未表明係屬抄件而被告又不能舉出證明係屬抄件應認其所辯為無理由不足採信但查被告此外並無參加匪幫組織及與匪幫勾結通謀之事證該函又係被告於楊裕昌臥室所寫當時僅楊裕昌及一司機吳玉翔在室寫畢復摺好交楊裕加轉呈李副總司令業經本部傳據楊裕昌到庭結證在卷顯與以文字為有利於叛徒之宣傳罪以對不特定人為之之構成要件未合第查被告冒用匪幫名義又採匪幫習用語句及違反政府反共抗俄國策之主張致函我最高當局其思想顯已受匪之毒害品情節尚非重大認有感化必要應予交付感化以資糾正感化期間另以命令定之\n據上論結應依刑事訴訟法第二百九十一條前段戡亂時期檢肅匪諜條例第八條第一項第二款判決如主文\n本案經軍事檢察官范覺非蒞庭執行職務\n中　華　民　國　四　十　四　年　十　一　月　二　日\n台灣省保安司令部軍事法庭\n審判官　王名馴\n右正本證明與原本無異\n中　華　民　國　四　十　五　年　一　月　十　四　日\n書記官　管萃恩"
}