{
    "id": "23326",
    "name": "劉昭岐、劉招枝",
    "gender": "男",
    "birth_h": "1927",
    "province": "臺灣省",
    "city": "臺北市",
    "edu": "暫無資料",
    "d1_num": "暫無資料",
    "occupation": "大成汽車行職員",
    "age": "22",
    "d1_per1": "暫無資料",
    "d1_crime1": "暫無資料",
    "d1_crime1cat": "暫無資料",
    "d1_law1": "暫無資料",
    "d1_prosec": "無",
    "d1_pa1": "暫無資料",
    "d1_clk1": "暫無資料",
    "d2_doc": "判決書",
    "d2_num1": "(38)訴字第17號",
    "d2_authority": "台灣高等法院",
    "d2_pa1": "馮正樞",
    "d2_atty1": "劉學恆",
    "d2_attycat": "公設",
    "d2_main1": "共同預備意圖以非法之方法顛覆政府",
    "d2_per1": "李薰山",
    "d2_per2": "林如堉",
    "d2_per3": "陳新財",
    "d2_per4": "周買",
    "d2_per5": "鄭文秀",
    "d2_per6": "許萬春",
    "d2_per7": "林溪海",
    "d2_per8": "倪阿明",
    "d2_per9": "張家聲",
    "d2_per10": "劉永和",
    "d2_per11": "高金財",
    "d2_per12": "王存賢",
    "d2_per13": "陳世沛",
    "d2_per14": "黃輝煌",
    "d2_per15": "陳隆得",
    "d2_term": "有",
    "d2_termy": "2",
    "d2_termm": "6",
    "d2_dpriv": "有",
    "d2_dprivy": "2",
    "d2_dprivm": "0",
    "d2_law1": "刑法",
    "d2_law1a": "28",
    "d2_law2": "刑法",
    "d2_law2a": "100",
    "d2_law2s": "2",
    "d2_j1": "高焱楙",
    "d2_j2": "章粹吾",
    "d2_j3": "羅萃儒",
    "d2_jpos1": "審判長推事",
    "d2_jpos2": "推事",
    "d2_jpos3": "推事",
    "d2_clk1": "李光明",
    "d2_y": "38",
    "d2_m": "12",
    "d2_d": "26",
    "d2_rejud": "無",
    "f_authority": "台灣高等法院",
    "f_jyear": "38",
    "f_num": "(38)訴字第17號",
    "f_pa1": "馮正樞",
    "f_atty1": "劉學恆",
    "f_attycat": "公設",
    "f_main1": "共同預備意圖以非法之方法顛覆政府",
    "f_group": "台灣人民解放同盟",
    "f_per1": "李薰山",
    "f_per2": "林如堉",
    "f_per3": "陳新財",
    "f_per4": "周買",
    "f_per5": "鄭文秀",
    "f_per6": "許萬春",
    "f_per7": "林溪海",
    "f_per8": "倪阿明",
    "f_per9": "張家聲",
    "f_per10": "劉永和",
    "f_per11": "高金財",
    "f_per12": "王存賢",
    "f_per13": "陳世沛",
    "f_per14": "黃輝煌",
    "f_per15": "陳隆得",
    "f_law1": "刑法",
    "f_law1a": "28",
    "f_law2": "刑法",
    "f_law2a": "100",
    "f_law2s": "2",
    "f_penaltytxt": "有期徒刑2年6月",
    "f_term": "有",
    "f_termy": "2",
    "f_termm": "6",
    "f_forf": "無",
    "f_j1": "高焱楙",
    "f_j2": "章粹吾",
    "f_j3": "羅萃儒",
    "f_clk1": "李光明",
    "f_y": "38",
    "f_m": "12",
    "f_d": "26",
    "f_txt": "【裁判字號】38，訴字，0017\n【裁判日期】870508\n【裁判機關】台灣高等法院刑事\n【受裁判者】李薰山、林如堉、劉抬枝、陳新財、周買、鄭文秀、許萬春、林溪海、繼河明、張家聲、劉永和、高金財、王存賢、陳世沛、黃輝煌、陳隆得\n【類　　別】判決書\n【裁判全文】\n\n台灣高等法院刑事判決　　　　　　　　　　　　　　　　　　　     三十八年度訴字第一七號\n    公訴人　本院檢察官\n被　告　李薰山　男　年二十八歲　新竹人　    業士林造紙廠職員  住台北縣\n　　　　林如堉　男　年二十六歲　台北縣人　業台北中學教員      住台北市\n　　　　劉抬枝　男　年二十二歲　台北市人　業大成汽車行職員  住台北市\n　　　　陳新財　男　年二十三歲　台北市人　業省府公役           住台北市\n　　　　周　買　男　年二十四歲　台北市人　業牛車工人     住台北市\n　　　　鄭文秀　男　年二十三歲　台北市人　業台大工役     住台北市\n　　　　許萬春　男　年二十一歲　台北市人　業電力公司工役   住台北市\n　　　　林溪海　男　年二十一歲　台北市人　業成衣   住台北市\n　　　　繼河明　男　年二十一歲　台北市　業郵差   住台北市\n　　　　張家聲　男　年二十三歲　台北市人　業商   住台北市\n　　　　劉永和　男　年二十一歲　台北市人　業商   住台北市\n　　　　高金財　男　年二十　歲　台北縣人　業修汽車   住文山區\n　　　　王存賢　男　年二十三歲　台北市人　業證章行   住台北市\n　　　　陳世沛　男　年二十　歲　台北市人　業工   住台北市\n　　　　黃輝煌　男　年二十一歲　台北市人　業學生   住台北市\n　　　　陳隆得　男　年二十三歲　台北市人　業牛角加工   住台北市\n右被告林溪海選任\n暨其等被告指定　辯護人　劉學恆律師\n右列被告因內亂案件經檢察官提起上訴，本院判決為左：\n　　主　文\n李薰山、林如堉共同預備意圖以非法之方法顛覆政府，各處有期徒刑三年六月，褫奪公權三年。\n劉抬枝、陳新財、周買共同預備意圖以非法之方法顛覆政府，各處有有期徒刑二年六朋，褫奪公權二年。\n鄭文秀、許萬春、林溪海、繼河明共同預備意圖以非法之方法顛覆政府，各處有期徒刑一年四月，褫奪公權一年。\n張家聲、劉永和、高金財、王存賢、陳世沛、黃輝煌、陳隆得均無罪。\n　　事　實\n李薰山係台大工學院畢業，於民國三十六年五、六月間任台大助教時，經吳思澤之介紹（時吳任新生報記者係共產黨台北市委）參加共產黨，因與該黨在台工作人員李絜、劉沼光等熟識、嗣李薰山介紹林如堉一同參加石時在林如堉處秘密集會，旋因公開以共產黨名義活難以發展，乃於今年十月改組為新民主同志會，便於號召當由李薰山、林如堉暨在逃陳炳基任該會計部、吸收劉抬枝、陳新財、周買為會員、更由劉、陳、周等三人輾轉介紹鄭文秀、林溪海、繼河明等陸續參加該李薰山、林如堉時以詆毀政府、破壞國第、反動宣傳員分發會閱讀三十七月復改名為台灣人民解放同盟內分宣傳、組織、教育三部，仍由李薰山、林如堉及陳炳基分任領導，進行其意圖顛覆政府之項備工作、業經台灣全省警備司令部偵悉分別逮捕，連同在林如堉處抄獲之宣傳品解送本院檢察官，依內亂罪提起公訴。\n\t理　由\n上開事實業據被告李薰山、林如堉在全省籌備司令部情報處暨軍法處分別自白，嗣雖在偵審中稍有翻辯，然對於參加共黨及吸收會員各節不予否認，核與各被告供詞互相參證，均屬相符，並有抄獲之黨案宣言等可證，犯行至證認定，其參加共黨印發反動書報並利用外圍組織吸收黨員，顯屬意圖以非法之方法顛覆政府，惟查其行為無罪藉宣傳以增強其黨力量，尚屬預備階段，不能謂為著手實行，檢察官依刑法第一百條第一項後段起訴，尚有未合，應依同條第二項論處，被告劉抬枝、陳新財、周買、鄭文秀、許萬春、林溪海、繼河明等參加其黨或其外圍組織，獲案當時歷歷之自承，有情報處暨軍法處各該被告之供詞可資覆按，均無置疑之餘地，要難因其事後避就而予卸免，應按其情節輕重分別量處應得之刑，並予褫奪公權、被告張家聲、劉永和、高金財、王存賢、陳世沛、黃輝煌、陳隆得等或因同學或結拜兄弟關係涉嫌被捕，既無參加共黨或其外圍組織情事，復難證明有顛覆政府之不法意圖，依法得難繩以刑責，應均諭知無罪。\n據上論結，應依刑事訴訟法第二百九十一條前段、第二百九十三條、第二百九十三條第一項、刑法第二十八條、第一百條第二項、第一項、第三十七條第二項、判決如主文。\n本案經檢察官馮正樞蒞庭執行職務。\n中　華　民　國　三　十　八　年　十　二　月　二　十　日\n（院銜）刑事庭\n審判長推事　高焱楙\n推事　章粹君\n推事　羅萃儒\n右抄本證明與原本無異\n書記官　黃月里\n中　華　民　國　八　十　七　年　　五　　月　　八　　日"
}