{
    "id": "23671",
    "name": "吳澍培、吳樹培 二",
    "gender": "男",
    "birth_h": "1932",
    "province": "臺灣省",
    "city": "臺中縣",
    "edu": "暫無資料",
    "d1_num": "暫無資料",
    "occupation": "本部新生訓導處第二大隊第七中隊新生",
    "age": "23",
    "d1_per1": "暫無資料",
    "d1_crime1": "暫無資料",
    "d1_crime1cat": "暫無資料",
    "d1_law1": "暫無資料",
    "d1_prosec": "無",
    "d1_pa1": "暫無資料",
    "d1_clk1": "暫無資料",
    "d2_doc": "判決書",
    "d2_num1": "(43)審三字第141號",
    "d2_authority": "台灣省保安司令部",
    "d2_pa1": "梅綬蓀",
    "d2_atty1": "馬心聲",
    "d2_attycat": "公設",
    "d2_main1": "無罪",
    "d2_per1": "鄭溪北",
    "d2_per2": "李金璧",
    "d2_per3": "謝日成",
    "d2_per4": "廖錦榮",
    "d2_per5": "翁啓林",
    "d2_per6": "凃龍西",
    "d2_penalty": "無",
    "d2_j1": "殷敬文",
    "d2_jpos1": "審判官",
    "d2_clk1": "劉齊",
    "d2_y": "43",
    "d2_m": "12",
    "d2_d": "8",
    "d2_rejud": "無",
    "f_authority": "台灣省保安司令部",
    "f_jyear": "43",
    "f_num": "(43)審三字第141號",
    "f_pa1": "梅綬蓀",
    "f_atty1": "馬心聲",
    "f_attycat": "公設",
    "f_main1": "無罪",
    "f_per1": "鄭溪北",
    "f_per2": "李金璧",
    "f_per3": "謝日成",
    "f_per4": "廖錦榮",
    "f_per5": "翁啓林",
    "f_per6": "凃龍西",
    "f_penaltytxt": "暫無資料",
    "f_penalty": "無",
    "f_forf": "x",
    "f_j1": "殷敬文",
    "f_clk1": "劉齊",
    "f_y": "43",
    "f_m": "12",
    "f_d": "27",
    "f_txt": "【裁判字號】43，審三，0141\n【裁判日期】431208\n【裁判機關】台灣省保安司令部\n【受裁判者】鄭溪北、李金璧、謝日成、廖錦榮、吳樹培、翁啟林、凃龍西\n【類　　別】判決書\n【裁判全文】\n\n台灣省保安司令部判決　　　　　　　　　　　　　　　　　　　     (43)審三字第〇一四一號\n    公訴人　本部軍事檢察官\n被　告　鄭溪北　男　年卅一歲　屏東縣人　本部新生訓導處第二大隊第七中隊新生　在押\n　　　　李金璧　男　年廿六歲　高雄縣人　同右\n　　　　謝日成　男　年廿六歲　苗栗縣人　同右\n　　　　廖錦榮　男　年三十歲　苗栗縣人　同右\n　　　　吳樹培　男　年廿三歲　彰化縣人　同右\n　　　　翁啟林　男　年廿六歲　彰化縣人　同右\n　　　　凃龍西　男　年卅四歲　桃園縣人　同右\n指定共同辯護人　本部公設辯護人　馬心聲\n右被告等因叛亂案件經軍事檢察官提起公訴本部判決如左\n　　主文\n鄭溪北李金璧謝日成廖錦榮吳樹培翁啟林凃龍西均無罪\n　　理由\n本案被告鄭溪北李金璧謝日成廖錦榮吳樹培翁啟林凃龍西均因參加叛亂之組織罪案件前經本部分別判處有期徒刑（詳列附卷內罪刑表）奉准確定後移送國防部台灣軍人監獄轉寄本部新生訓導處執行編入該處第二大隊第七中隊感訓於四十二年九十月間該處第三大隊第九中隊匪俘新生梁耀光密謀刦船逃返大陸該鄭溪北等涉有參加預備暴動之嫌經該處扣案由軍事檢察官偵查以預備以非法之方法顛覆政府罪嫌提起公訴其所持理由不外該被告等在新生訓導處業已自認不諱戶任屬實並有悔過書存卷可考但查被告隻自白非出於強暴鞋迫或其他不正方法者固得為證據然仍應調查必要證據以察其自白是否與事實相符此為刑事訴訟法第二百七十條所明訂該被告鄭溪北等在偵審各庭不特均否認有與梁耀光認識及密謀暴動情事並稱在新生訓導處隻共詞及悔過書均係受脅騙所為即訊據梁耀光證述亦謂與鄭溪北等並不認識其計畫搶船跑回大陸之事僅與同隊（第九中隊）幾個熟人談過並未與其他中隊之人言及等語此外幼無其他直接證據足以認定該被告鄭溪北等有協謀預備暴動犯行尚難令負刑責是該被告鄭溪北等犯罪不能證明除各照前原判罪刑移間繼續直執行外均應予諭知無罪\n據上論結應依懲治叛亂條例第十條後段刑事訴訟法第二百九十三條第一項判決如主文\n本案經軍事檢察官梅綬蓀蒞庭執行職務\n中　華　民　國　四　十　三　年　十　二　月　四　日\n台灣省保安司令部軍事法庭\n審判官　殷敬文\n右正本證明與原本無異。\n書記官　劉　齊\n中　華　民　國　四　十　三　年　十　二　月　八　日"
}