{
    "id": "24065",
    "name": "周江海",
    "gender": "男",
    "province": "臺灣省",
    "city": "臺北市",
    "edu": "暫無資料",
    "d1_num": "暫無資料",
    "occupation": "陰陽",
    "age": "44",
    "d1_per1": "暫無資料",
    "d1_crime1": "暫無資料",
    "d1_crime1cat": "暫無資料",
    "d1_law1": "暫無資料",
    "d1_prosec": "無",
    "d1_pa1": "暫無資料",
    "d1_clk1": "暫無資料",
    "d2_doc": "判決書",
    "d2_num1": "(41)安潔字第2812號",
    "d2_authority": "台灣省保安司令部",
    "d2_pa1": "嚴同暉",
    "d2_atty1": "蕭與規",
    "d2_attycat": "公設",
    "d2_main1": "誣告他人參加叛亂之組織",
    "d2_term": "有",
    "d2_termy": "5",
    "d2_termm": "0",
    "d2_dpriv": "有",
    "d2_dprivy": "3",
    "d2_dprivm": "0",
    "d2_law1": "檢肅匪諜條例",
    "d2_law1a": "10",
    "d2_law1s": "1",
    "d2_law2": "懲治叛亂條例",
    "d2_law2a": "5",
    "d2_law3": "刑法",
    "d2_law3a": "59",
    "d2_j1": "邢炎初",
    "d2_jpos1": "審判官",
    "d2_clk1": "湛棣",
    "d2_y": "41",
    "d2_m": "10",
    "d2_d": "7",
    "d2_rejud": "無",
    "f_authority": "台灣省保安司令部",
    "f_jyear": "41",
    "f_num": "(41)安潔字第2812號",
    "f_pa1": "嚴同暉",
    "f_atty1": "蕭與規",
    "f_attycat": "公設",
    "f_main1": "誣告他人參加叛亂之組織",
    "f_law1": "檢肅匪諜條例",
    "f_law1a": "10",
    "f_law1s": "1",
    "f_law2": "懲治叛亂條例",
    "f_law2a": "5",
    "f_law3": "刑法",
    "f_law3a": "59",
    "f_penaltytxt": "有期徒刑5年，褫奪公權3年",
    "f_term": "有",
    "f_termy": "5",
    "f_termm": "0",
    "f_forf": "無",
    "f_j1": "邢炎初",
    "f_clk1": "湛棣",
    "f_y": "41",
    "f_m": "10",
    "f_d": "7",
    "f_txt": "【裁判字號】41，安潔，2812\n【裁判日期】411007\n【裁判機關】台灣省保安司令部\n【受裁判者】周江海\n【類　　別】判決書\n【裁判全文】\n\n台灣省保安司令部判決　　　　　　　　　　　　　　　　　　　     (41)安潔字第二八一二號\n    公訴人　本部軍事檢察官\n被　告　周江海　男　年四十四歲　台北市人　住台北市　業陰陽\n指定辯護人　本部公設辯護人　蕭與規\n右被告因誣告叛亂案件經軍事檢察官提起公訴本部判決如左：\n　　主文\n周江海誣告他人參加叛亂之組織處有期徒刑五年褫奪公權三年\n　　事實\n周江海因現住座落台北市南昌街二段第二十三號房屋產權糾紛為其侄周廷芳囑即遷讓恐被迫遷乃於本年（四十一）六月間向台北憲兵隊控告周廷芳參加叛亂之組織經該隊查明係挾嫌誣告將案解由台北地方法院檢察處轉送本部經軍事檢察官偵查提起公訴\n　　理由\n被告周江海對於其侄周廷芳囑遷讓房屋因而憤怒捏造事實誣告周廷芳係匪諜意圖周廷芳受刑事處分之事實迭據供認不諱且有台北憲兵隊呈案之被告控告書為證并經傳據周廷芳到案訊明確未參加叛亂之組織純係被告周江海挾嫌誣害屬實犯情極臻明確被告周江海雖以該房屋為祖產係與其亡兄周　霞等共同公有及恐其侄周廷芳歐打等語作誣控之理由但查房屋產權縱有糾紛亦應依訴訟程序依法解決至於歐打一節不但周廷芳矢口否認有越禮情事即被告亦承認并未受何歐辱是被告之誣控行為已出手保護生命財產方法之外所辯理由不足採信被告知其侄周廷芳未參加匪幫而控係匪諜顯有使人受刑事處分之故意應依誣告他人參加叛亂之組織罪論處惟查被告一時憤怒誣控其侄而罹重典衡情不無可憫姑予依法減輕科處以示矜恤\n據上論結應依戒嚴法第八條第二項刑事訴訟法第二百九十一條前段戡亂時期檢肅匪諜條例第十條第一項懲治叛亂條例第五條刑法第十一條前段第三十七條第二項第五十九條判決如主文\n本案經軍事檢察官嚴同暉蒞庭執行職務\n中　華　民　國　四　十　一　年　十　月　三　日\n台灣省保安司令部軍事法庭\n審判官　邢炎初\n右正本證明與原本無異\n中　華　民　國　四　十　一　年　十　月　七　日\n書記官　湛　棣"
}