{
    "id": "24133",
    "name": "譚吉昌",
    "gender": "男",
    "birth_h": "1925",
    "province": "江西",
    "city": "南城縣",
    "edu": "暫無資料",
    "d1_num": "暫無資料",
    "occupation": "陸軍八三三八部隊一等兵",
    "age": "30",
    "d1_per1": "暫無資料",
    "d1_crime1": "暫無資料",
    "d1_crime1cat": "暫無資料",
    "d1_law1": "暫無資料",
    "d1_prosec": "無",
    "d1_pa1": "暫無資料",
    "d1_clk1": "暫無資料",
    "d2_doc": "判決書",
    "d2_num1": "(43)審三字第63號",
    "d2_authority": "台灣省保安司令部",
    "d2_pa1": "梅綬蓀",
    "d2_atty1": "馬心聲",
    "d2_attycat": "公設",
    "d2_main1": "以文字為有利於叛徒之宣傳",
    "d2_term": "有",
    "d2_termy": "7",
    "d2_termm": "0",
    "d2_dpriv": "有",
    "d2_dprivy": "4",
    "d2_dprivm": "0",
    "d2_law1": "懲治叛亂條例",
    "d2_law1a": "7",
    "d2_j1": "殷敬文",
    "d2_jpos1": "審判官",
    "d2_clk1": "管萃恩",
    "d2_y": "43",
    "d2_m": "6",
    "d2_d": "11",
    "d2_rejud": "無",
    "f_authority": "台灣省保安司令部",
    "f_jyear": "43",
    "f_num": "(43)審三字第63號",
    "f_pa1": "梅綬蓀",
    "f_atty1": "馬心聲",
    "f_attycat": "公設",
    "f_main1": "以文字為有利於叛徒之宣傳",
    "f_law1": "懲治叛亂條例",
    "f_law1a": "7",
    "f_penaltytxt": "有期徒刑7年褫奪公權4年",
    "f_term": "有",
    "f_termy": "7",
    "f_termm": "0",
    "f_forf": "無",
    "f_j1": "殷敬文",
    "f_clk1": "管萃恩",
    "f_y": "43",
    "f_m": "6",
    "f_d": "11",
    "f_txt": "【裁判字號】43，審三，0063\n【裁判日期】430520\n【裁判機關】台灣省保安司令部\n【受裁判者】譚吉昌\n【類　　別】判決書\n【裁判全文】\n\n台灣省保安司令部判決　　　　　　　　　　　　　　　　　　　     (43)審三字第〇〇六三號\n    公訴人　本部軍事檢察官\n被　告　譚吉昌　男　年三十歲　江西南城縣人　陸軍八三三八部隊一等兵　在押\n指定辯護人　本部公設辯護人　馬心聲\n右被告因叛亂案件經軍事檢察官提起公訴本部判決如左\n　　主文\n譚吉昌以文字為有利於叛徒之宣傳處有期徒刑七年褫奪公權四年\n　　事實\n被告譚吉昌原係陸軍第二十五軍第一四八師文書上士三十八年八月間在福建永泰戰役被朱毛匪幫俘獲學習看護思想染匪毒素同年十月間隨匪軍犯金門經我軍救回編入陸軍八三三八部隊服役於四十二年六月間病後稍不如意遂將軍中日記中　總統肖像撕去在戰友週報上印有　總統肖像之處亦任意塗畫又將反共抗俄歌曲中之反共抗俄字句全用墨水塗掉至九月廿六日復在蘇澳中山路巷內牆上以粉筆書寫歌頌毛匪之反動宣傳標語經該管部隊長查悉扣案奉國防部四十二年十一月廿六日（４２）昌署字第三六九四號及四十三年二月廿日（４３）清淮字第二二五號令授權本部審判經軍事檢察官偵查起訴\n　　理由\n被告譚吉昌對於四十二年夏間曾撕去及塗畫　總統肖像幷用墨水塗掉歌曲中反共抗俄字句暨同年九月廿六日以粉筆大書祝頌毛匪字句於蘇澳中山路巷內牆上等事實業據該被告在偵審各庭均自認不諱核與該管部隊查報情形相符並有繳案之日記本戰士週報歌本等可證查該被告被俘虜受匪毒化教育思想染有毒素偶有不滿任意洩憤其書寫祝頌毛匪字句標語於眾所共睹之牆壁上以剌人心自應構成以文字為有利於叛徒之宣傳罪責犯證明確酌情予以最低刑論科\n據上論結應依戰時陸海空軍審判簡易規程第二條第一項前段第八條刑事訴訟法第二百九十一條前段懲治叛亂條例第七條第十條第十二條刑法第卅七條第二項判決如主文\n本案經軍事檢察官梅綬蓀蒞庭執行職務。\n中　華　民　國　四　十　三　年　五　月　十　八　日\n台灣省保安司令部軍事法庭\n審判官　殷敬文\n右正本證明與原本無異\n中　華　民　國　四　十　三　年　五　月　二　十　日\n書記官　管萃恩"
}