{
    "id": "24151",
    "name": "余天河",
    "gender": "男",
    "province": "河南",
    "city": "魯山縣",
    "edu": "暫無資料",
    "d1_num": "暫無資料",
    "occupation": "陸軍8453部隊上士班長",
    "age": "32",
    "d1_per1": "暫無資料",
    "d1_crime1": "暫無資料",
    "d1_crime1cat": "暫無資料",
    "d1_law1": "暫無資料",
    "d1_prosec": "無",
    "d1_pa1": "暫無資料",
    "d1_clk1": "暫無資料",
    "d2_doc": "判決書",
    "d2_num1": "(43)審三字第16號",
    "d2_authority": "台灣省保安司令部",
    "d2_pa1": "蕭與規",
    "d2_atty1": "馬心聲",
    "d2_attycat": "公設",
    "d2_main1": "以文字為有利於叛徒之宣傳",
    "d2_term": "有",
    "d2_termy": "3",
    "d2_termm": "6",
    "d2_law1": "懲治叛亂條例",
    "d2_law1a": "7",
    "d2_law2": "刑法",
    "d2_law2a": "59",
    "d2_j1": "邢炎初",
    "d2_jpos1": "審判官",
    "d2_clk1": "魏俊生",
    "d2_y": "43",
    "d2_m": "2",
    "d2_d": "18",
    "d2_rejud": "無",
    "f_authority": "台灣省保安司令部",
    "f_jyear": "43",
    "f_num": "(43)審三字第16號",
    "f_pa1": "蕭與規",
    "f_atty1": "馬心聲",
    "f_attycat": "公設",
    "f_main1": "以文字為有利於叛徒之宣傳",
    "f_law1": "懲治叛亂條例",
    "f_law1a": "7",
    "f_law2": "刑法",
    "f_law2a": "59",
    "f_penaltytxt": "有期徒刑3年6月",
    "f_term": "有",
    "f_termy": "3",
    "f_termm": "6",
    "f_forf": "無",
    "f_j1": "邢炎初",
    "f_clk1": "魏俊生",
    "f_y": "43",
    "f_m": "3",
    "f_d": "26",
    "f_txt": "【裁判字號】43，審三，0016\n【裁判日期】430218\n【裁判機關】台灣省保安司令部\n【受裁判者】余天河\n【類　　別】判決書\n【裁判全文】\n\n台灣省保安司令部判決　　　　　　　　　　　　　　　　　　　         (43)審三字第十六號\n    公訴人　本部軍事檢察官\n被　告　余天河　男　年卅二歲　河南魯山縣人　陸軍八四五三部隊上士班長　在押\n指定辯護人　本部公設辯護人　馬心聲\n右被告因叛亂案件經軍事檢察官提起公訴本部判決如左\n　　主文\n余天河以文字為有利於叛徒之宣傳處有期徒刑三年六月\n　　事實\n余天河係陸軍八四五三部隊上士班長於民國四十年　月間因與同班士兵劉趙發生鬪歐經上級予以降級處分二月嗣又於四十二年八月六日奉令調衛生連充當列兵心有不滿請求調離未獲允准乃於同月八日夜書寫推翻三民主義實行共產主義打倒國民黨解救台灣鐵幕籠裏同胞等反動文字一紙貼於該部隊廁所內使人週知經查覺由該管軍部呈報　國防部四十二年十月廿四日（４２）昌署字第三四五一號令該軍部將卷犯等解交本部審辦經軍事檢察官偵查提起公訴\n　　理由\n被告余天河對於民國四十二年八月八日晚書寫推翻三民主義實行共產主義打倒國民黨解救台灣鐵幕籠裏周胞等反動文字一紙貼於八四五三部隊廁所使人週知之事實業據直認不諱核與該部隊及本部保安處軍事檢察官偵查結果互相一致且有獲案之反動文字一紙為證犯情極臻明確雖被告以與士兵鬪歐上級處分失當嗣又調充列兵有辱體面經請調離原單位未獲允准乃憤而出此希被查覺脫離原單位等語為辯解但核上級處分下級縱或失當仍應依照正當手續申復不能以破壞國策之文字使人週知為手段且被告明知所書寫文字貼於公共廁所係有利於叛徒之宣傳而仍擇為手段顯有惡意自不能任其詭詞狡辯諉卸刑責應依以文字為有利於叛徒之宣傳罪論處惟查被告於庭訊時坦白直承深知悛悔且經該管軍部查明被告平日思想正直工作勤謹衡情可憫應依最低刑減輕科處以勵自新\n據上論結應依戰時陸海空軍審判簡易規程第二條第一項前段第八條刑事訴訟法第二百九十一條前段懲治叛亂條例第七條第十條前段第本二條刑法第五十九條判決如主文\n本案經軍事檢察官蕭與規蒞庭執行職務\n中　華　民　國　四　十　三　年　二　月　十　六　日\n台灣省保安司令部軍事法庭\n審判官　邢炎初\n右正本證明與原本無異\n中　華　民　國　四　十　三　年　二　月　十　八　日\n書記官　魏俊生"
}