{
    "id": "24172",
    "name": "李坤地",
    "gender": "男",
    "province": "臺灣省",
    "city": "臺中縣",
    "edu": "暫無資料",
    "d1_num": "暫無資料",
    "occupation": "工",
    "age": "26",
    "d1_per1": "暫無資料",
    "d1_crime1": "暫無資料",
    "d1_crime1cat": "暫無資料",
    "d1_law1": "暫無資料",
    "d1_prosec": "無",
    "d1_pa1": "暫無資料",
    "d1_clk1": "暫無資料",
    "d2_doc": "判決書",
    "d2_num1": "(44)審特字第1號",
    "d2_authority": "台灣省保安司令部",
    "d2_pa1": "端木棪",
    "d2_atty1": "馬心聲",
    "d2_attycat": "公設",
    "d2_main1": "故意陷害誣告他人參加叛亂之組織",
    "d2_term": "有",
    "d2_termy": "5",
    "d2_termm": "0",
    "d2_dpriv": "有",
    "d2_dprivy": "3",
    "d2_dprivm": "0",
    "d2_law1": "懲治叛亂條例",
    "d2_law1a": "5",
    "d2_law2": "刑法",
    "d2_law2a": "216",
    "d2_law3": "刑法",
    "d2_law3a": "210",
    "d2_j1": "周咸慶",
    "d2_j2": "邢炎初",
    "d2_j3": "彭國壎",
    "d2_jpos1": "審判長",
    "d2_jpos2": "審判官",
    "d2_jpos3": "審判官",
    "d2_clk1": "沙思奇",
    "d2_y": "44",
    "d2_m": "1",
    "d2_d": "27",
    "d2_rejud": "無",
    "f_authority": "台灣省保安司令部",
    "f_jyear": "44",
    "f_num": "(44)審特字第1號",
    "f_pa1": "端木棪",
    "f_atty1": "馬心聲",
    "f_attycat": "公設",
    "f_main1": "故意陷害誣告他人參加叛亂之組織",
    "f_law1": "懲治叛亂條例",
    "f_law1a": "5",
    "f_law2": "刑法",
    "f_law2a": "216",
    "f_law3": "刑法",
    "f_law3a": "210",
    "f_penaltytxt": "有期徒刑5年褫奪公權3年",
    "f_term": "有",
    "f_termy": "5",
    "f_termm": "0",
    "f_forf": "無",
    "f_j1": "周咸慶",
    "f_j2": "邢炎初",
    "f_j3": "彭國壎",
    "f_clk1": "沙思奇",
    "f_y": "44",
    "f_m": "1",
    "f_d": "27",
    "f_txt": "【裁判字號】44，審特，0001\n【裁判日期】440127\n【裁判機關】台灣省保安司令部\n【受裁判者】李坤地\n【類　　別】判決書\n【裁判全文】\n\n台灣省保安司令部判決　　　　　　　　　　　　　　　　　　　           (44)審特字第一號\n    公訴人　本部軍事檢察官\n被　告　李坤地　男　年二十六歲　台中縣人　住台中縣　業工在押\n指定辯護人　本部公設辯護人　馬心聲\n右被告因誣告匪諜案件經軍事檢察官提起公訴本部判決如左\n　　主文\n李坤地故意陷害誣告他人參加叛亂之組織處有期徒刑五年褫奪公權三年\n　　事實\n李坤地原在彰化縣二水警察派出所充當警員因與巡佐黃鴻聲不睦於四十一年三月被調往彰化縣警察局保安警察隊又因行為不檢於同年七月經該隊隊長鄭秉新報准革職從此失業心中懷恨乃於四十二年七月冒用黃鴻聲名義書寫報告一件捏稱鄭秉新與共產份子連絡時間每日下午八點至十二點在市內公共場所請密查嚴辦等語寄呈台灣省警務處以圖陷害案經台灣省警務處發覺係李坤地挾嫌冒名誣告將該李坤地押解本部由軍事檢察官偵查起訴\n　　理由\n被告李坤地對於四十二年七月挾嫌冒用黃鴻聲名義書寫報告一件捏稱鄭秉新與共產份子連絡等語寄呈台灣省警務處以圖陷害之事實已據在彰化縣警察局台灣省警務處及本部偵審中迭次坦承不諱核與台灣省警務處所報情形及所送原報告抄件相符犯情已極明確查該被告誣告鄭秉新與匪幫連絡即指其已加入匪幫組織自應以誣告他人參加叛亂之組織論又其冒用黃鴻聲名義書寫報告寄呈本係行使與偽造私文書罪偽造之低度行為為行使之高度行為所吸收應以行使偽造私文書論惟查其行使偽造私文書與誣告匪諜有方法結果關係應從一重之故意陷害誣告他人參加叛亂之組織罪處斷復查其事後尚知悔悟於所誣告之案件裁判確定前即坦承自白爰予減輕其刑以勵自新\n據上論結應依戒嚴法第八條第一項刑事訴訟法第二百九十一條前段戡亂時期檢肅匪諜條例第十條第一項第三項懲治叛亂條例第五條刑法第二百十六條第二百十條第十一條前段第五十五條第卅七條第二項判決如主文\n本案經軍事檢察官端木棪蒞庭執行職務\n中　華　民　國　四　十　四　年　元　月　十　七　日\n台灣省保安司令部軍法合議庭\n審判長　周咸慶\n審判官　邢炎初\n審判官　彭國壎\n右正本證明與原本無異\n中　華　民　國　四　十　四　年　元　月　廿　七　日\n書記官　沙思奇"
}