{
    "id": "24183",
    "name": "李萬開",
    "gender": "男",
    "province": "廣東",
    "city": "汕頭縣",
    "edu": "暫無資料",
    "d1_num": "暫無資料",
    "occupation": "聚發船船員",
    "age": "19",
    "d1_per1": "暫無資料",
    "d1_crime1": "暫無資料",
    "d1_crime1cat": "暫無資料",
    "d1_law1": "暫無資料",
    "d1_prosec": "無",
    "d1_pa1": "暫無資料",
    "d1_clk1": "暫無資料",
    "d2_doc": "判決書",
    "d2_num1": "(45)審特字第001號",
    "d2_authority": "台灣省保安司令部",
    "d2_pa1": "張幼文",
    "d2_atty1": "馬心聲",
    "d2_attycat": "公設",
    "d2_main1": "參加叛亂之組織",
    "d2_main2": "走私部份均免訴",
    "d2_per1": "楊應秋",
    "d2_term": "有",
    "d2_termy": "5",
    "d2_termm": "0",
    "d2_dpriv": "有",
    "d2_dprivy": "3",
    "d2_dprivm": "0",
    "d2_law1": "懲治叛亂條例",
    "d2_law1a": "5",
    "d2_law2": "刑法",
    "d2_law2a": "59",
    "d2_j1": "王名馴",
    "d2_j2": "周咸慶",
    "d2_j3": "彭國壎",
    "d2_jpos1": "審判長",
    "d2_jpos2": "審判官",
    "d2_jpos3": "審判官",
    "d2_clk1": "劉齊",
    "d2_y": "45",
    "d2_m": "11",
    "d2_d": "26",
    "d2_rejud": "無",
    "f_authority": "台灣省保安司令部",
    "f_jyear": "45",
    "f_num": "(45)審特字第001號",
    "f_pa1": "張幼文",
    "f_atty1": "馬心聲",
    "f_attycat": "公設",
    "f_main1": "參加叛亂之組織",
    "f_main2": "走私部份均免訴",
    "f_per1": "楊應秋",
    "f_law1": "懲治叛亂條例",
    "f_law1a": "5",
    "f_law2": "刑法",
    "f_law2a": "59",
    "f_penaltytxt": "有期徒刑5年，褫奪公權3年",
    "f_term": "有",
    "f_termy": "5",
    "f_termm": "0",
    "f_forf": "無",
    "f_j1": "王名馴",
    "f_j2": "周咸慶",
    "f_j3": "彭國壎",
    "f_clk1": "劉齊",
    "f_y": "45",
    "f_m": "11",
    "f_d": "26",
    "f_txt": "【裁判字號】45，審特，0001\n【裁判日期】451126\n【裁判機關】台灣省保安司令部\n【受裁判者】李萬開、楊應秋\n【類　　別】判決書\n【裁判全文】\n\n台灣省保安司令部判決　　　　　　　　　　　　　　　　　　　       (45)審特字第○○一號\n    公訴人　本部軍事檢察官\n被　告　李萬開　男　年十　九歲　廣東汕頭人　住聚發船上  業聚發船船員（在押）\n　　　　楊應秋　男　年四十三歲　廣東潮安人　住香港大道　業聚發船船員（在押）\n指定辯護人　本部公設辯護人　馬心聲\n右列被告因叛亂等案件經軍事檢察官提起公訴本部判決如左\n　　主文\n李萬開楊應秋參加叛亂之組織各處有期徒刑五年各褫奪公權三年被訴走私部份均免訴\n　　事實\n李萬開楊應秋均係香港聚發船船員李萬開於民國卅九年間楊應秋於四十二年間各在香港參加朱毛匪幫所操縱之海員工會四十四年九月十八日同隨聚發船私運煙紙七件來台於高雄經本部查獲解由軍事檢察官偵查提起公訴\n　　理由\n被告李萬開楊應秋對於在香港參加朱毛匪幫操縱之海員工會之事實雖據該被告等於本部軍事檢察官偵查庭及審理中矢口否認但查該被告等均於本部保安處分別供認於卅九年四十二年間參加匪香港海員工會在卷核與該處飭查結果「楊李二人在港確曾加入匪香港海員工會」相符雖被告等辯稱在本部保安處之供述係受刑訊與恐嚇等情但經該處四十五年一月廿一日（４５）昌晶字第○○七號函復該被告等均係自行坦白供認並無受刑與恐嚇情事在案自難任其空言翻異犯情已臻明確惟查該海員工會係朱毛匪幫外圍組織被告等知慮淺薄一時失檢參加核其情節不無可憫爰各以參加叛亂之組織罪減輕科處以示矜卹至被告等被訴同於四十四年九月間由香港來台私運煙紙七件進口之事實雖經查明屬實依犯罪時懲治走私條例第一條之規定固係觸犯私運政府管制物品進口罪惟查該條例業經　總統於四十四年十二月廿九日明令修正公佈依修正之該條例第二條第二項規定所稱走私管制物品以經行政院依本條例專案指定公告者為限經查行政院四十五年五月十五日所公告指定之管制進出口物品項目中並無煙紙一項則被告等私運煙紙進口後法律已廢止其刑罰依法應均予諭知免訴\n據上論結應依戡亂時期檢肅匪諜條例第　　條軍事審判法第一百七十三條前段第一百七十六條第四款懲治叛亂條例第十條後段第五條第十二條刑法第五十九條第卅七條第二項判決如主文\n本案經軍事檢察官張幼文蒞庭執行職務。\n中　華　民　國　四　十　五　年　十　一　月　十　七　日\n台灣省保安司令部審判庭\n審判長　王名馴\n審判官　周咸慶\n審判官　彭國壎\n右判決正本證明與原本無異\n如不服本判決應於送達後十日內以文書提出於本部聲請覆判\n書記官　劉　齊\n中　華　民　國　四　十　五　年　十　一　月　廿　六　日"
}